{
    "AWS_ACCESS_KEY_ID": "... AWS key with write access to buckets ...",
    "AWS_SECRET_ACCESS_KEY": "... AWS secret key with write access buckets ...",
    "AWS_S3_BUCKETS": {
        "LOGS": "... s3 logs bucket name ...",
        "VIDEOS": "... s3 video bucket name ..."
    },
    "CONTACT_SWITCHES": [
        {
            "NAME": "... name and pin-out of a GPIO switch...",
            "GPIO": 12
        }
    ],
    "LOGZ_IO_CODE": "... logz io's logger code ...",
    "SLACK_APP_SIGNING_SECRET": "... secret value from slack to validate bot messages ...",
    "SLACK_APP_TOKEN": "... token from slack to allow app to use websockets ...",
    "SLACK_BOT_TOKEN": "... token from slack...",
    "SLACK_CHANNEL": "... proper name of slack channel ...",
    "SLACK_CHANNEL_ID": ".. slack's ID for the channel ...",
    "TEMPERATURE_SENSORS": {
        "DHT11": [
            {
                "NAME": "... name and pin-out of a GPIO with a DHT11 connected ...",
                "GPIO": 4
            }
        ]
    }
}
